{
  "$schema": "https://json-schema.org/draft/2020-12/schema",
  "title": "AcceptanceResult",
  "type": "object",
  "required": ["sqlKey", "status", "equivalence", "perfComparison", "securityChecks"],
  "properties": {
    "sqlKey": {"type": "string"},
    "status": {"type": "string"},
    "rewrittenSql": {"type": ["string", "null"]},
    "equivalence": {
      "type": "object",
      "properties": {
        "checked": {"type": ["boolean", "null"]},
        "method": {"type": ["string", "null"]},
        "rowCount": {"type": ["object", "null"]},
        "keySetHash": {"type": ["object", "null"]},
        "rowSampleHash": {"type": ["object", "null"]},
        "evidenceRefs": {"type": ["array", "null"], "items": {"type": "string"}},
        "evidenceRefObjects": {"type": ["array", "null"], "items": {"type": "object"}}
      }
    },
    "perfComparison": {
      "type": "object",
      "properties": {
        "checked": {"type": ["boolean", "null"]},
        "method": {"type": ["string", "null"]},
        "beforeSummary": {"type": ["object", "null"]},
        "afterSummary": {"type": ["object", "null"]},
        "reasonCodes": {"type": ["array", "null"], "items": {"type": "string"}},
        "improved": {"type": ["boolean", "null"]},
        "error": {"type": ["string", "null"]},
        "evidenceRefs": {"type": ["array", "null"], "items": {"type": "string"}},
        "evidenceRefObjects": {"type": ["array", "null"], "items": {"type": "object"}}
      }
    },
    "securityChecks": {"type": "object"},
    "feedback": {"type": ["object", "null"]},
    "rewriteStrategy": {"type": "string"},
    "rewriteIntent": {"type": ["object", "null"]},
    "rewriteMaterialization": {"type": ["object", "null"]},
    "semanticRisk": {"type": "string"},
    "regressionSignals": {"type": "array"},
    "decisionTrace": {"type": ["array", "null"], "items": {"type": "object"}},
    "selectedCandidateSource": {"type": "string"},
    "selectedCandidateId": {"type": ["string", "null"]},
    "candidateEvaluations": {"type": "array", "items": {"type": "object"}},
    "candidateEval": {"type": ["object", "null"]},
    "warnings": {"type": "array", "items": {"type": "string"}},
    "riskFlags": {"type": "array", "items": {"type": "string"}},
    "llmTraceRefs": {"type": "array", "items": {"type": "string"}},
    "selectionReason": {"type": ["object", "null"]},
    "selectionRationale": {"type": ["object", "null"]},
    "deliveryReadiness": {"type": ["object", "null"]},
    "decisionLayers": {"type": ["object", "null"]},
    "guardrailDecisions": {"type": ["array", "null"], "items": {"type": "object"}},
    "templateRewriteOps": {"type": ["array", "null"], "items": {"type": "object"}},
    "repairability": {"type": ["object", "null"]},
    "repairHints": {"type": ["array", "null"], "items": {"type": "object"}},
    "rewriteSafetyLevel": {"type": ["string", "null"]},
    "patchability": {"type": ["object", "null"]},
    "selectedPatchStrategy": {"type": ["object", "null"]},
    "dynamicTemplate": {
      "type": ["object", "null"],
      "properties": {
        "present": {"type": ["boolean", "null"]},
        "shapeFamily": {"type": ["string", "null"]},
        "capabilityTier": {"type": ["string", "null"]},
        "patchSurface": {"type": ["string", "null"]},
        "baselineFamily": {"type": ["string", "null"]},
        "blockingReason": {"type": ["string", "null"]},
        "deliveryClass": {"type": ["string", "null"]}
      }
    },
    "canonicalization": {"type": ["object", "null"]},
    "rewriteFacts": {"type": ["object", "null"]},
    "patchStrategyCandidates": {"type": ["array", "null"], "items": {"type": "object"}},
    "canonicalizationAssessment": {"type": ["array", "null"], "items": {"type": "object"}},
    "candidateSelectionTrace": {"type": ["array", "null"], "items": {"type": "object"}},
    "semanticEquivalence": {
      "type": ["object", "null"],
      "properties": {
        "status": {"type": ["string", "null"]},
        "confidence": {"type": ["string", "null"]},
        "confidenceBeforeUpgrade": {"type": ["string", "null"]},
        "confidenceUpgradeApplied": {"type": ["boolean", "null"]},
        "confidenceUpgradeReasons": {"type": ["array", "null"], "items": {"type": "string"}},
        "confidenceUpgradeEvidenceSources": {"type": ["array", "null"], "items": {"type": "string"}},
        "evidenceLevel": {"type": ["string", "null"]},
        "checks": {"type": ["object", "null"]},
        "reasons": {"type": ["array", "null"], "items": {"type": "string"}},
        "hardConflicts": {"type": ["array", "null"], "items": {"type": "string"}},
        "equivalenceOverrideApplied": {"type": ["boolean", "null"]},
        "equivalenceOverrideRule": {"type": ["string", "null"]},
        "coverage": {"type": ["object", "null"]},
        "evidence": {"type": ["object", "null"]}
      }
    }
  }
}
