{
  "sqlKey": "demo.test.complex.trimSuffixOrderBy#v1",
  "status": "NEED_MORE_PARAMS",
  "equivalence": {
    "checked": true,
    "method": "static",
    "evidenceRefs": []
  },
  "perfComparison": {
    "checked": false,
    "reasonCodes": ["VALIDATE_SECURITY_DOLLAR_SUBSTITUTION"],
    "improved": null
  },
  "securityChecks": {"dollar_substitution_removed": false},
  "semanticRisk": "high",
  "feedback": {"reason_code": "VALIDATE_SECURITY_DOLLAR_SUBSTITUTION", "message": "unsafe ${} pattern"},
  "selectedCandidateSource": "rule",
  "riskFlags": ["DOLLAR_SUBSTITUTION"],
  "rewriteMaterialization": {
    "mode": "UNMATERIALIZABLE",
    "reasonCode": "DOLLAR_SUBSTITUTION_PRESENT"
  },
  "deliveryReadiness": {
    "tier": "BLOCKED",
    "blockingReasons": ["DOLLAR_SUBSTITUTION"]
  },
  "repairHints": [
    {"hintId": "whitelist-sort-field", "title": "Whitelist sort field values", "detail": "map sortField to whitelist before SQL", "actionType": "MANUAL_REVIEW"}
  ]
}