{
  "sqlKey": "demo.test.complex.ifWhereLimit#v1",
  "status": "PASS",
  "equivalence": {
    "checked": true,
    "method": "sql_semantic_compare_v2",
    "rowCount": {"status": "MATCH", "before": 5, "after": 5}
  },
  "perfComparison": {
    "checked": false,
    "reasonCodes": ["VALIDATE_PLAN_COMPARE_CONFIG_DISABLED"],
    "improved": null
  },
  "securityChecks": {"dollar_substitution_removed": true},
  "semanticRisk": "low",
  "feedback": null,
  "selectedCandidateSource": "llm",
  "warnings": ["VALIDATE_PERF_NOT_IMPROVED_WARN"],
  "riskFlags": [],
  "rewrittenSql": "SELECT id, name FROM users WHERE status = #{status} AND name LIKE CONCAT('%', #{namePattern}, '%') LIMIT 20",
  "selectedCandidateId": "candidate_1",
  "rewriteMaterialization": {
    "mode": "STATEMENT_TEMPLATE_SAFE",
    "targetType": "STATEMENT",
    "targetRef": "demo.test.complex.ifWhereLimit",
    "reasonCode": "STATEMENT_INCLUDE_SAFE",
    "replayVerified": true
  },
  "deliveryReadiness": {
    "tier": "READY",
    "autoPatchLikelihood": "HIGH",
    "blockingReasons": []
  },
  "decisionLayers": {
    "acceptance": {"status": "PASS", "validationProfile": "balanced"}
  },
  "semanticEquivalence": {
    "status": "PASS",
    "confidence": "HIGH",
    "evidenceLevel": "DB_FINGERPRINT"
  }
}